Front,Back,Week,Status,Frequency,PartOfSpeech
German for: seat (আসন); include article and plural,"Platz | plural: -ä, e | IPA: dɛɾ plˈats | Bitte nehmen Sie Platz! | Please take a seat! | বাংলা সহায়তা: “আসন” অর্থটি এই বাক্যে ব্যবহৃত হয়েছে।",5,active,very common,noun
German for: square (চৌকো); include article and plural,"Platz | plural: -ä, e | IPA: dɛɾ plˈats | Ich wohne neben dem Platz. | I live next to the square. | বাংলা সহায়তা: “চৌকো” অর্থটি এই বাক্যে ব্যবহৃত হয়েছে।",5,active,very common,noun
German for: chips (ফ্রেঞ্চ ফ্রাই); include article and plural,Pommes frites (pl.) | plural: — | IPA: diː pˈɔməs frˈiːtəs | Die Kinder essen Hähnchen mit Pommes frites. | The children are eating chicken and chips. | বাংলা সহায়তা: “ফ্রেঞ্চ ফ্রাই” অর্থটি এই বাক্যে ব্যবহৃত হয়েছে।,5,active,very common,noun
German for: post office (ডাকঘর); include article and plural,"Post | plural: — | IPA: diː pˈɔst | Wo ist die Post, bitte? | Where is the post office, please? | বাংলা সহায়তা: “ডাকঘর” অর্থটি এই বাক্যে ব্যবহৃত হয়েছে।",5,active,very common,noun
German for: post / mail (পোষ্ট); include article and plural,Post | plural: — | IPA: diː pˈɔst | Ist Post da? | Is there post? | বাংলা সহায়তা: “পোষ্ট” অর্থটি এই বাক্যে ব্যবহৃত হয়েছে।,5,active,very common,noun
German for: postcode (ডাক কোড); include article and plural,Postleitzahl | plural: — | IPA: diː pˈɔstlaɪtsˌɑːl | Wie ist Ihre Postleitzahl? | What is your postcode? | বাংলা সহায়তা: “ডাক কোড” অর্থটি এই বাক্যে ব্যবহৃত হয়েছে।,5,active,very common,noun
German for: internship (ইন্টার্নশিপ); include article and plural,Praktikum | plural: — | IPA: das pɾˈaktiːkˌʊm | Ich mache ein Praktikum bei Siemens. | I am doing an internship at Siemens. | বাংলা সহায়তা: “ইন্টার্নশিপ” অর্থটি এই বাক্যে ব্যবহৃত হয়েছে।,5,active,very common,noun
German for: practice (অভ্যাস); include article and plural,Praxis | plural: — | IPA: diː pɾˈaksɪs | Die Praxis ist ab acht Uhr geöffnet. | The practice is open from 8 am. | বাংলা সহায়তা: “অভ্যাস” অর্থটি এই বাক্যে ব্যবহৃত হয়েছে।,5,active,very common,noun
German for: problem (সমস্যা); include article and plural,Problem | plural: -e | IPA: das pɾoːblˈeːm | Mein Problem ist die Sprache. | My problem is the language. | বাংলা সহায়তা: “সমস্যা” অর্থটি এই বাক্যে ব্যবহৃত হয়েছে।,5,active,very common,noun
German for: brochure (তথ্যপুস্তিকা); include article and plural,Prospekt | plural: -e | IPA: dɛɾ pɾoːspˈɛkt | Bitte schicken Sie mir einen Prospekt von Ihrem Hotel. | Please send me a brochure for your hotel. | বাংলা সহায়তা: “তথ্যপুস্তিকা” অর্থটি এই বাক্যে ব্যবহৃত হয়েছে।,5,active,very common,noun
German for: sharp (ধারাল),pünktlich | plural: — | IPA: pˈʏŋktlɪç | Der Bus fährt pünktlich um acht Uhr. | The bus leaves at 8 am sharp. | বাংলা সহায়তা: “ধারাল” অর্থটি এই বাক্যে ব্যবহৃত হয়েছে।,5,active,very common,adjective/adverb/other
German for: punctual (সময়নিষ্ঠ),pünktlich | plural: — | IPA: pˈʏŋktlɪç | Herr Müller ist immer pünktlich. | Mr Müller is always punctual. | বাংলা সহায়তা: “সময়নিষ্ঠ” অর্থটি এই বাক্যে ব্যবহৃত হয়েছে।,5,active,very common,adjective/adverb/other
German for: to cycle (চক্র),Rad fahren | plural: — | IPA: rˈɑːt fˈɑːrən | Das Kind kann schon Rad fahren. | The child can already ride a bike. | বাংলা সহায়তা: “চক্র” অর্থটি এই বাক্যে ব্যবহৃত হয়েছে।,5,active,very common,verb
German for: to smoke (ধূমপান করা),rauchen | plural: — | IPA: rˈaʊxən | Ich rauche nicht. | I don’t smoke. | বাংলা সহায়তা: “ধূমপান করা” অর্থটি এই বাক্যে ব্যবহৃত হয়েছে।,5,active,very common,verb
German for: bill (বিল); include article and plural,"Rechnung | plural: -en | IPA: diː rˈɛçnʊŋ | Die Rechnung, bitte. | The bill, please. | বাংলা সহায়তা: “বিল” অর্থটি এই বাক্যে ব্যবহৃত হয়েছে।",5,active,very common,noun
German for: rice (ধান); include article and plural,Reis | plural: — | IPA: dɛɾ rˈaɪs | Ich esse gern Reis. | I like eating rice. | বাংলা সহায়তা: “ধান” অর্থটি এই বাক্যে ব্যবহৃত হয়েছে।,5,active,very common,noun
German for: tour guide (পর্যটক গাইড); include article and plural,Reiseführer | plural: — | IPA: dɛɾ rˈaɪzeːfˌyːrɜ | Unser Reiseführer heißt Peter. | Our tour guide is called Peter. | বাংলা সহায়তা: “পর্যটক গাইড” অর্থটি এই বাক্যে ব্যবহৃত হয়েছে।,5,active,common,noun
German for: to repair (মেরামত),reparieren | plural: — | IPA: rˌeːparˈiːrən | Er hat das Fahrrad repariert. | He repaired the bicycle. | বাংলা সহায়তা: “মেরামত” অর্থটি এই বাক্যে ব্যবহৃত হয়েছে।,5,active,common,verb
German for: repair (মেরামত); include article and plural,Reparatur | plural: — | IPA: diː rˈeːparˌɑtuːɾ | Die Reparatur ist sehr teuer. | The repair is very expensive. | বাংলা সহায়তা: “মেরামত” অর্থটি এই বাক্যে ব্যবহৃত হয়েছে।,5,active,common,noun
German for: reception (অভ্যর্থনা ডেস্ক); include article and plural,Rezeption | plural: — | IPA: diː rˌeːtsɛptsɪˈoːn | Fragen Sie bitte im Hotel an der Rezeption. | Please ask at the hotel reception. | বাংলা সহায়তা: “অভ্যর্থনা ডেস্ক” অর্থটি এই বাক্যে ব্যবহৃত হয়েছে।,5,active,common,noun
German for: to smell (গন্ধ),riechen | plural: — | IPA: rˈiːçən | Dieser Wein riecht gut. | This wine smells good. | বাংলা সহায়তা: “গন্ধ” অর্থটি এই বাক্যে ব্যবহৃত হয়েছে।,5,active,common,verb
German for: quiet (শান্ত),ruhig | plural: — | IPA: rˈuːɪç | Ich möchte ein ruhiges Zimmer. | I would like a quiet room. | বাংলা সহায়তা: “শান্ত” অর্থটি এই বাক্যে ব্যবহৃত হয়েছে।,5,active,common,adjective/adverb/other
German for: juice (রস); include article and plural,Saft | plural: — | IPA: dɛɾ zˈaft | Möchtest du einen Apfelsaft? | Would you like an apple juice? | বাংলা সহায়তা: “রস” অর্থটি এই বাক্যে ব্যবহৃত হয়েছে।,5,recognition,common,noun
German for: to say / tell (বল),"sagen | plural: — | IPA: zˈɑːɡən | Sag mal, wie geht es dir denn? | Tell me, how’s it going? | বাংলা সহায়তা: “বল” অর্থটি এই বাক্যে ব্যবহৃত হয়েছে।",5,recognition,common,verb
German for: salad (সালাদ); include article and plural,Salat | plural: — | IPA: dɛɾ zalˈɑːt | Wie schmeckt dir der Salat? | How does the salad taste? | বাংলা সহায়তা: “সালাদ” অর্থটি এই বাক্যে ব্যবহৃত হয়েছে।,5,recognition,common,noun
German for: salt (নুন); include article and plural,"Salz | plural: — | IPA: das zˈalts | Entschuldigung, kann ich bitte das Salz haben? | Excuse me, can I have the salt please? | বাংলা সহায়তা: “নুন” অর্থটি এই বাক্যে ব্যবহৃত হয়েছে।",5,recognition,common,noun
German for: sentence (বাক্য); include article and plural,"Satz | plural: -ä, e | IPA: dɛɾ zˈats | Dieser Satz ist sehr einfach. | This sentence is very simple. | বাংলা সহায়তা: “বাক্য” অর্থটি এই বাক্যে ব্যবহৃত হয়েছে।",5,recognition,common,noun
German for: counter (কাউন্টার); include article and plural,Schalter | plural: — | IPA: dɛɾ ʃˈaltɜ | Gehen Sie bitte zum Schalter drei! | Please go to counter 3! | বাংলা সহায়তা: “কাউন্টার” অর্থটি এই বাক্যে ব্যবহৃত হয়েছে।,5,recognition,common,noun
German for: to shine (কিরণ দেওয়া),scheinen | plural: — | IPA: ʃˈaɪnən | Die Sonne scheint. | The sun is shining. | বাংলা সহায়তা: “কিরণ দেওয়া” অর্থটি এই বাক্যে ব্যবহৃত হয়েছে।,5,recognition,common,verb
German for: to send (পাঠাও),schicken | plural: — | IPA: ʃˈɪkən | Bitte schicken Sie mir eine E-Mail. | Please send me an email. | বাংলা সহায়তা: “পাঠাও” অর্থটি এই বাক্যে ব্যবহৃত হয়েছে।,5,recognition,common,verb
German for: sign (চিহ্ন); include article and plural,Schild | plural: -er | IPA: das ʃˈɪlt | Haben Sie nicht das Schild gesehen? | Did you not see the sign? | বাংলা সহায়তা: “চিহ্ন” অর্থটি এই বাক্যে ব্যবহৃত হয়েছে।,5,recognition,common,noun
German for: ham (শুকরের মাংস); include article and plural,Schinken | plural: – | IPA: dɛɾ ʃˈɪŋkən | Ich möchte gern ein Schinkenbrot. | I would like a ham roll. | বাংলা সহায়তা: “শুকরের মাংস” অর্থটি এই বাক্যে ব্যবহৃত হয়েছে।,5,recognition,common,noun
German for: to sleep (ঘুমান),schlafen | plural: — | IPA: ʃlˈɑːfən | Ich schlafe meistens acht Stunden. | I usually sleep for eight hours. | বাংলা সহায়তা: “ঘুমান” অর্থটি এই বাক্যে ব্যবহৃত হয়েছে।,5,recognition,common,verb
German for: to close (নিকট),"schließen | plural: — | IPA: ʃlˈiːsən | Bitte, schließen Sie die Tür. | Please close the door. | বাংলা সহায়তা: “নিকট” অর্থটি এই বাক্যে ব্যবহৃত হয়েছে।",5,recognition,common,verb
German for: closed (বন্ধ),geschlossen | plural: — | IPA: ɡəʃlˈɔsən | Die Bank hat am Samstag geschlossen. | The bank is closed on Saturday. | বাংলা সহায়তা: “বন্ধ” অর্থটি এই বাক্যে ব্যবহৃত হয়েছে।,5,recognition,common,adjective/adverb/other
German for: … (প্রাসঙ্গিক বাক্যাংশ); include article and plural,Schluss | plural: — | IPA: dɛɾ ʃlˈʊs | Ich muss jetzt Schluss machen. | I need to finish/wrap up now. | বাংলা সহায়তা: “প্রাসঙ্গিক বাক্যাংশ” অর্থটি এই বাক্যে ব্যবহৃত হয়েছে।,5,recognition,common,noun
German for: end (শেষ); include article and plural,"Schluss | plural: — | IPA: dɛɾ ʃlˈʊs | Zum Schluss gibt er uns allen die Hand. | At the end, he shakes everyone’s hand. | বাংলা সহায়তা: “শেষ” অর্থটি এই বাক্যে ব্যবহৃত হয়েছে।",5,recognition,common,noun
German for: key (মূখ্য); include article and plural,Schlüssel | plural: – | IPA: dɛɾ ʃlˈʏsəl | Ich gebe Ihnen noch den Zimmerschlüssel. | I’ll give you the room key as well. | বাংলা সহায়তা: “মূখ্য” অর্থটি এই বাক্যে ব্যবহৃত হয়েছে।,5,recognition,common,noun
German for: to taste (স্বাদ),schmecken | plural: — | IPA: ʃmˈɛkən | Schmeckt das gut? | Does that taste good? | বাংলা সহায়তা: “স্বাদ” অর্থটি এই বাক্যে ব্যবহৃত হয়েছে।,5,recognition,common,verb
German for: quick / fast (দ্রুত),schnell | plural: — | IPA: ʃnˈɛl | Er fährt schnell. | He drives fast. | বাংলা সহায়তা: “দ্রুত” অর্থটি এই বাক্যে ব্যবহৃত হয়েছে।,5,recognition,common,adjective/adverb/other
German for: already (ইতিমধ্যে),schon | plural: — | IPA: ʃˈoːn | Ist das Essen schon fertig? | Is the food done already? | বাংলা সহায়তা: “ইতিমধ্যে” অর্থটি এই বাক্যে ব্যবহৃত হয়েছে।,5,recognition,common,adjective/adverb/other
German for: lovely (খুব সুন্দর),schön | plural: — | IPA: ʃˈøːn | Schönen Urlaub! | Have a lovely holiday! | বাংলা সহায়তা: “খুব সুন্দর” অর্থটি এই বাক্যে ব্যবহৃত হয়েছে।,5,recognition,common,adjective/adverb/other
German for: cupboard (আলমারি); include article and plural,"Schrank | plural: -ä, e | IPA: dɛɾ ʃrˈaŋk | Die Gläser stehen im Schrank. | The glasses are in the cupboard. | বাংলা সহায়তা: “আলমারি” অর্থটি এই বাক্যে ব্যবহৃত হয়েছে।",5,recognition,common,noun
German for: pupil (ছাত্র); include article and plural,Schüler | plural: – | IPA: dɛɾ ʃˈyːlɜ | In meinem Kurs sind acht Schülerinnen und fünf Schüler. | In my course there are 8 female pupils and 5 male pupils. | বাংলা সহায়তা: “ছাত্র” অর্থটি এই বাক্যে ব্যবহৃত হয়েছে।,5,recognition,common,noun
German for: heavy (ভারী),schwer | plural: — | IPA: ʃvˈeːɾ | Ist Ihr Gepäck sehr schwer? | Is your luggage very heavy? | বাংলা সহায়তা: “ভারী” অর্থটি এই বাক্যে ব্যবহৃত হয়েছে।,5,recognition,common,adjective/adverb/other
German for: difficult (কঠিন),schwer | plural: — | IPA: ʃvˈeːɾ | Das ist eine schwere Arbeit. | That is a very difficult job. | বাংলা সহায়তা: “কঠিন” অর্থটি এই বাক্যে ব্যবহৃত হয়েছে।,5,recognition,common,adjective/adverb/other
German for: to swim (সাঁতার কাটা),schwimmen | plural: — | IPA: ʃvˈɪmən | Ich schwimme jeden Tag einen Kilometer. | I swim a kilometre every day. | বাংলা সহায়তা: “সাঁতার কাটা” অর্থটি এই বাক্যে ব্যবহৃত হয়েছে।,5,recognition,common,verb
German for: swimming pool (সুইমিং পুল); include article and plural,Schwimmbad | plural: — | IPA: das ʃvˈɪmbɑːt | Kommst du mit ins Schwimmbad? | Are you coming to the swimming pool with us? | বাংলা সহায়তা: “সুইমিং পুল” অর্থটি এই বাক্যে ব্যবহৃত হয়েছে।,5,recognition,common,noun
German for: lake (হ্রদ); include article and plural,"See | plural: — | IPA: dɛɾ zˈeː | Komm, wir fahren zum Starnberger See. | Come, we’re going to Starnberg lake. | বাংলা সহায়তা: “হ্রদ” অর্থটি এই বাক্যে ব্যবহৃত হয়েছে।",5,recognition,common,noun
German for: to see (দেখা),sehen | plural: — | IPA: zˈeːən | Ich kann dich nicht sehen. | I can’t see you. | বাংলা সহায়তা: “দেখা” অর্থটি এই বাক্যে ব্যবহৃত হয়েছে।,5,recognition,common,verb
German for: to see (দেখা),sehen | plural: — | IPA: zˈeːən | Ich habe diesen Jungen schon einmal gesehen. | I have seen this boy before. | বাংলা সহায়তা: “দেখা” অর্থটি এই বাক্যে ব্যবহৃত হয়েছে।,5,recognition,common,verb
German for: sights/attractions (দর্শনীয় স্থান); include article and plural,Sehenswürdigkeit | plural: -en | IPA: diː zˈeːənsvˌʏɾdɪçkˌaɪt | Welche Sehenswürdigkeiten gibt es in Frankfurt? | Which sights are there to see in Frankfurt? | বাংলা সহায়তা: “দর্শনীয় স্থান” অর্থটি এই বাক্যে ব্যবহৃত হয়েছে।,5,recognition,common,noun
German for: very (খুব),sehr | plural: — | IPA: zˈeːɾ | Danke sehr! | Thank you very much! | বাংলা সহায়তা: “খুব” অর্থটি এই বাক্যে ব্যবহৃত হয়েছে।,5,recognition,common,adjective/adverb/other
German for: very (খুব),sehr | plural: — | IPA: zˈeːɾ | Das ist sehr schwer. | That is very heavy. | বাংলা সহায়তা: “খুব” অর্থটি এই বাক্যে ব্যবহৃত হয়েছে।,5,recognition,common,adjective/adverb/other
German for: his (তার),sein | plural: — | IPA: zˈaɪn | Herr Müller ist in seinem Zimmer. | Mr Müller is in his room. | বাংলা সহায়তা: “তার” অর্থটি এই বাক্যে ব্যবহৃত হয়েছে।,5,recognition,common,adjective/adverb/other
