Front,Back,Week,Status,Frequency,PartOfSpeech
German for: breakfast (নাশতা); include article and plural,Frühstück | plural: — | IPA: das frˈyːʃtʏk | Möchtest du ein Ei zum Frühstück? | Would you like an egg for breakfast? | বাংলা সহায়তা: “নাশতা” অর্থটি এই বাক্যে ব্যবহৃত হয়েছে।,1,active,very common,noun
German for: tour (ভ্রমণ); include article and plural,Führung | plural: — | IPA: diː fˈyːrʊŋ | Die Führung durch das Haus beginnt in 3 Minuten. | The tour of the house begins in 3 minutes. | বাংলা সহায়তা: “ভ্রমণ” অর্থটি এই বাক্যে ব্যবহৃত হয়েছে।,1,active,very common,noun
German for: foot (হাঁটা); include article and plural,"Fuß | plural: -ü, e | IPA: dɛɾ fˈuːs | Der linke Fuß tut mir weh. | My left foot hurts. | বাংলা সহায়তা: “হাঁটা” অর্থটি এই বাক্যে ব্যবহৃত হয়েছে।",1,active,very common,noun
German for: football (ফুটবল); include article and plural,Fußball | plural: — | IPA: dɛɾ fˈʊsbal | Spielt ihr gerne Fußball? | Do you like playing football? | বাংলা সহায়তা: “ফুটবল” অর্থটি এই বাক্যে ব্যবহৃত হয়েছে।,1,active,very common,noun
German for: garden (উদ্দ্যান); include article and plural,Garten | plural: — | IPA: dɛɾ ɡˈaɾtən | Wir haben leider keinen Garten. | Unfortunately we don't have a garden. | বাংলা সহায়তা: “উদ্দ্যান” অর্থটি এই বাক্যে ব্যবহৃত হয়েছে।,1,active,very common,noun
German for: guest (অতিথী); include article and plural,"Gast | plural: -ä, e | IPA: dɛɾ ɡˈast | Am Wochenende haben wir mehrere Gäste. | At the weekend we have several guests. | বাংলা সহায়তা: “অতিথী” অর্থটি এই বাক্যে ব্যবহৃত হয়েছে।",1,active,very common,noun
German for: birth year (জন্মসাল); include article and plural,"Geburtsjahr | plural: — | IPA: das ɡəbˈʊɐtsjɑːɾ | Das Geburtsjahr Ihres Sohnes, bitte? | Your son's year of birth, please? | বাংলা সহায়তা: “জন্মসাল” অর্থটি এই বাক্যে ব্যবহৃত হয়েছে।",1,active,common,noun
German for: birthplace (জন্মস্থান); include article and plural,Geburtsort | plural: — | IPA: dɛɾ ɡəbˈʊɐtsɔɾt | Bitte schreiben Sie Ihren Geburtsort auf das Formular. | Please write your birthplace on the form. | বাংলা সহায়তা: “জন্মস্থান” অর্থটি এই বাক্যে ব্যবহৃত হয়েছে।,1,active,common,noun
German for: birthday (জন্মদিন); include article and plural,Geburtstag | plural: — | IPA: dɛɾ ɡəbˈʊɐtstɑːk | Herzlichen Glückwunsch zum Geburtstag! | Best wishes on your birthday! | বাংলা সহায়তা: “জন্মদিন” অর্থটি এই বাক্যে ব্যবহৃত হয়েছে।,1,active,common,noun
German for: money (অর্থ); include article and plural,Geld | plural: — | IPA: das ɡˈɛlt | Hast du noch Geld? | Do you still have money? | বাংলা সহায়তা: “অর্থ” অর্থটি এই বাক্যে ব্যবহৃত হয়েছে।,1,active,common,noun
German for: luggage (লাগেজ); include article and plural,Gepäck | plural: — | IPA: das ɡəpˈɛk | Wollen Sie Ihr Gepäck mitnehmen? | Do you want to take your luggage with you? | বাংলা সহায়তা: “লাগেজ” অর্থটি এই বাক্যে ব্যবহৃত হয়েছে।,1,active,common,noun
German for: present (বর্তমান); include article and plural,Geschenk | plural: -e | IPA: das ɡəʃˈɛŋk | Danke für das schöne Geschenk. | Thank you for the beautiful present. | বাংলা সহায়তা: “বর্তমান” অর্থটি এই বাক্যে ব্যবহৃত হয়েছে।,1,active,common,noun
German for: siblings (ভাইবোন); include article and plural,Geschwister (pl.) | plural: — | IPA: diː ɡəʃvˈɪstɜ | Ich habe leider keine Geschwister. | Unfortunately I have no siblings. | বাংলা সহায়তা: “ভাইবোন” অর্থটি এই বাক্যে ব্যবহৃত হয়েছে।,1,recognition,common,noun
German for: conversation/talk/call (কথোপকথন); include article and plural,Gespräch | plural: -e | IPA: das ɡəʃpɾˈɛç | Das Gespräch mit Frau Kunz ist um 14 Uhr. | The conversation with Ms Kunz is at 2 pm. | বাংলা সহায়তা: “কথোপকথন” অর্থটি এই বাক্যে ব্যবহৃত হয়েছে।,1,recognition,common,noun
German for: weight (ওজন); include article and plural,"Gewicht | plural: — | IPA: das ɡəvˈɪçt | Bei „Gewicht“ schreibst du: 62 Kilo. | For “weight”, write 62 kg. | বাংলা সহায়তা: “ওজন” অর্থটি এই বাক্যে ব্যবহৃত হয়েছে।",1,recognition,common,noun
German for: glass (কাঁচ); include article and plural,"Glas | plural: -ä, er | IPA: das ɡlˈɑːs | Bitte noch ein Glas Wein! | Another glass of wine, please! | বাংলা সহায়তা: “কাঁচ” অর্থটি এই বাক্যে ব্যবহৃত হয়েছে।",1,recognition,common,noun
German for: glasses (চশমা); include article and plural,"Glas | plural: -ä, er | IPA: das ɡlˈɑːs | Wir brauchen noch drei Gläser. | We need three more glasses. | বাংলা সহায়তা: “চশমা” অর্থটি এই বাক্যে ব্যবহৃত হয়েছে।",1,recognition,common,noun
German for: luck (ভাগ্য); include article and plural,Glück | plural: — | IPA: das ɡlˈʏk | Viel Glück! | Good luck! | বাংলা সহায়তা: “ভাগ্য” অর্থটি এই বাক্যে ব্যবহৃত হয়েছে।,1,recognition,common,noun
German for: congratulations (অভিনন্দন); include article and plural,Glückwunsch | plural: — | IPA: dɛɾ ɡlˈʏkvʊnʃ | Herzlichen Glückwunsch zum Geburtstag. | Best wishes on your birthday! | বাংলা সহায়তা: “অভিনন্দন” অর্থটি এই বাক্যে ব্যবহৃত হয়েছে।,1,recognition,common,noun
German for: degrees (ডিগ্রি),Grad (Celsius) | plural: — | IPA: ɡɾˈɑːt | Heute haben wir dreißig Grad. | Today it is thirty degrees. | বাংলা সহায়তা: “ডিগ্রি” অর্থটি এই বাক্যে ব্যবহৃত হয়েছে।,1,recognition,common,noun/phrase
German for: grandparents (দাদা-দাদি বা নানা-নানি); include article and plural,Großeltern (pl.) | plural: — | IPA: diː ɡɾˈoːsɛltɜn | Meine Großeltern leben in Japan. | My grandparents live in Japan. | বাংলা সহায়তা: “দাদা-দাদি বা নানা-নানি” অর্থটি এই বাক্যে ব্যবহৃত হয়েছে।,1,recognition,common,noun
German for: grandmother (দাদি বা নানি); include article and plural,Großmutter | plural: — | IPA: diː ɡɾˈɔsmʊtɜ | Meine Großmutter heißt Eva. | My grandmother is called Eva. | বাংলা সহায়তা: “দাদি বা নানি” অর্থটি এই বাক্যে ব্যবহৃত হয়েছে।,1,recognition,common,noun
German for: grandfather (দাদা বা নানা); include article and plural,Großvater | plural: — | IPA: dɛɾ ɡɾˈɔsfɑːtɜ | Mein Großvater ist schon 80. | My grandfather is already 80. | বাংলা সহায়তা: “দাদা বা নানা” অর্থটি এই বাক্যে ব্যবহৃত হয়েছে।,1,recognition,common,noun
German for: group (শ্রেণী); include article and plural,Gruppe | plural: -n | IPA: diː ɡɾˈʊpə | Die erste Gruppe beginnt um 16 Uhr. | The first group begins at 4 pm. | বাংলা সহায়তা: “শ্রেণী” অর্থটি এই বাক্যে ব্যবহৃত হয়েছে।,1,recognition,common,noun
German for: regards (শুভেচ্ছা); include article and plural,"Gruß | plural: -ü, e | IPA: dɛɾ ɡɾˈuːs | Viele Grüße an Ihre Frau. | Give my regards to your wife. | বাংলা সহায়তা: “শুভেচ্ছা” অর্থটি এই বাক্যে ব্যবহৃত হয়েছে।",1,recognition,common,noun
German for: regards (শুভেচ্ছা); include article and plural,"Gruß | plural: -ü, e | IPA: dɛɾ ɡɾˈuːs | Mit freundlichen Grüßen | Kind regards. | বাংলা সহায়তা: “শুভেচ্ছা” অর্থটি এই বাক্যে ব্যবহৃত হয়েছে।",1,recognition,common,noun
German for: hair (চুল); include article and plural,Haar | plural: -e | IPA: das hˈɑːɾ | Sie hat lange Haare. | She has long hair. | বাংলা সহায়তা: “চুল” অর্থটি এই বাক্যে ব্যবহৃত হয়েছে।,1,recognition,common,noun
German for: chicken (মুরগি); include article and plural,"Hähnchen | plural: - | IPA: das hˈɛːnçən | Ein Hähnchen mit Pommes bitte! | Chicken with chips, please! | বাংলা সহায়তা: “মুরগি” অর্থটি এই বাক্যে ব্যবহৃত হয়েছে।",1,recognition,common,noun
German for: half-board (dining) (সকাল ও রাতের খাবারসহ থাকা); include article and plural,Halbpension | plural: — | IPA: diː hˌalppɛnzjˈoːn | Möchten Sie Vollpension oder Halbpension? | Would you like full or half-board? | বাংলা সহায়তা: “সকাল ও রাতের খাবারসহ থাকা” অর্থটি এই বাক্যে ব্যবহৃত হয়েছে।,1,recognition,common,noun
German for: hall (হল-ঘর); include article and plural,Halle | plural: — | IPA: diː hˈalə | Wir treffen uns in Halle B. | We will meet in hall B. | বাংলা সহায়তা: “হল-ঘর” অর্থটি এই বাক্যে ব্যবহৃত হয়েছে।,1,recognition,common,noun
German for: (public transport) stop (থামা); include article and plural,"Haltestelle | plural: -en, | IPA: diː hˈaltɛʃtˌɛlə | An der nächsten Haltestelle müssen Sie aussteigen. | At the next stop you must alight. | বাংলা সহায়তা: “থামা” অর্থটি এই বাক্যে ব্যবহৃত হয়েছে।",1,recognition,common,noun
German for: hand (হাত); include article and plural,"Hand | plural: -ä, e | IPA: diː hˈant | Er gibt mir die Hand. | He gives me his hand. | বাংলা সহায়তা: “হাত” অর্থটি এই বাক্যে ব্যবহৃত হয়েছে।",1,recognition,common,noun
German for: home (বাড়ি); include article and plural,"Haus | plural: -ä, er | IPA: das hˈaʊs | Ich gehe jetzt nach Hause. | I’m going home now. | বাংলা সহায়তা: “বাড়ি” অর্থটি এই বাক্যে ব্যবহৃত হয়েছে।",1,recognition,common,noun
German for: home (বাড়ি); include article and plural,"Haus | plural: -ä, er | IPA: das hˈaʊs | Paul ist nicht zu Hause. | Paul is not home. | বাংলা সহায়তা: “বাড়ি” অর্থটি এই বাক্যে ব্যবহৃত হয়েছে।",1,recognition,common,noun
German for: homework (বাড়ির কাজ); include article and plural,Hausaufgabe | plural: -n | IPA: diː hˈaʊsˌaʊfɡˌɑːbə | Kannst du mir bei den Hausaufgaben helfen? | Can you help me with the homework? | বাংলা সহায়তা: “বাড়ির কাজ” অর্থটি এই বাক্যে ব্যবহৃত হয়েছে।,1,recognition,common,noun
German for: home (বাড়ি); include article and plural,Heimat | plural: — | IPA: diː hˈaɪmɑːt | Ich komme aus der Schweiz. Das ist meine Heimat. | I come from Switzerland. It’s my home. | বাংলা সহায়তা: “বাড়ি” অর্থটি এই বাক্যে ব্যবহৃত হয়েছে।,1,recognition,common,noun
German for: stove (চুল্লি); include article and plural,Herd | plural: — | IPA: dɛɾ hˈeːɾt | In der neuen Küche fehlt noch der Herd. | The stove is still missing from the new kitchen. | বাংলা সহায়তা: “চুল্লি” অর্থটি এই বাক্যে ব্যবহৃত হয়েছে।,1,recognition,common,noun
German for: Mister (জনাব); include article and plural,"Herr | plural: -en | IPA: dɛɾ hˈɛɾ | Guten Tag, Herr Sommer! | Good day, Mr Sommer! | বাংলা সহায়তা: “জনাব” অর্থটি এই বাক্যে ব্যবহৃত হয়েছে।",1,recognition,common,noun
German for: marriage (বিবাহ); include article and plural,Hochzeit | plural: — | IPA: diː hˈoːxtsˌaɪt | Zur dieser Hochzeit kommen mehr als fünfzig Gäste. | More than fifty guests are coming to this wedding. | বাংলা সহায়তা: “বিবাহ” অর্থটি এই বাক্যে ব্যবহৃত হয়েছে।,1,recognition,common,noun
German for: hunger (ক্ষুধা); include article and plural,Hunger | plural: — | IPA: dɛɾ hˈʊŋɜ | Ich habe Hunger! Wann ist das Essen fertig? | I’m hungry! When will the food be ready? | বাংলা সহায়তা: “ক্ষুধা” অর্থটি এই বাক্যে ব্যবহৃত হয়েছে।,1,recognition,common,noun
German for: information point (তথ্যকেন্দ্র); include article and plural,"Information | plural: -en | IPA: diː ˌɪnfɔɾmˌatsɪˈoːn | Wenn Sie Fragen haben, gehen Sie zur Information. | If you have questions, go to the information point. | বাংলা সহায়তা: “তথ্যকেন্দ্র” অর্থটি এই বাক্যে ব্যবহৃত হয়েছে।",1,recognition,common,noun
German for: information (তথ্য); include article and plural,Information | plural: -en | IPA: diː ˌɪnfɔɾmˌatsɪˈoːn | Wir haben hier wichtige Informationen für Sie. | We have important information for you. | বাংলা সহায়তা: “তথ্য” অর্থটি এই বাক্যে ব্যবহৃত হয়েছে।,1,recognition,common,noun
